Name,Age,Gender,Education_Level,Field_of_Study,Degrees,Institute_Name,Graduation_Year,Experience_Years,Current_Job_Title,Previous_Job_Titles,Skills,Certifications,Target_Job_Description
Sophia Krishnan,35,Non-Binary,Bachelor's,Psychology,Bachelor's in Psychology,Harvard University,2017,6,Project Manager,"Content Manager, Financial Analyst","Project Management, Leadership, Problem Solving, Team Management, Medical Knowledge","Licensed Professional Counselor, Certified Financial Analyst, Certified Sales Professional",Seeking a challenging role as a Project Manager where I can apply my skills and knowledge to contribute to organizational success and professional growth.
Samantha Kim,42,Male,PhD,Architecture,PhD in Architecture,Columbia University,2025,0,None,None,"Time Management, SEO, Adaptability, Emotional Intelligence, PowerPoint, Quality Assurance, Problem Solving, Strategic Planning","Google Ads Certified, Registered Nurse License, SHRM Certified Professional",Looking for an opportunity as a Operations Manager to leverage my expertise in architecture and make a meaningful impact in the industry.
Abhinav Srinivasan,32,Male,Master's,Dentistry,Master's in Dentistry,SRM Institute of Science and Technology,2020,2,Dentist,None,"Financial Analysis, Marketing, Data Analysis, PowerPoint, Leadership, Negotiation, Time Management, Critical Thinking",Digital Marketing Institute Certified,Looking for an opportunity as a Dentist to leverage my expertise in dentistry and make a meaningful impact in the industry.
Aryan Park,42,Non-Binary,Bachelor's,Pharmacy,Bachelor's in Pharmacy,Indian Institute of Technology Bombay,2019,2,Brand Manager,None,"Medical Knowledge, Organizational Skills, Healthcare, Negotiation","SHRM Certified Professional, Registered Nurse License",Looking for an opportunity as a Brand Manager to leverage my expertise in pharmacy and make a meaningful impact in the industry.
Aadhya Mittal,38,Female,Bachelor's,Accounting,Bachelor's in Accounting,SRM Institute of Science and Technology,2019,4,Business Development Manager,None,"Negotiation, Medical Knowledge, Social Media Marketing, Time Management, Budgeting, Strategic Planning",None,"Targeting a Business Development Manager position to contribute to organizational growth through strategic planning, client acquisition, and partnership development."
Abhinav Jackson,25,Female,Bachelor's,Accounting,Bachelor's in Accounting,Carnegie Mellon University,2024,0,None,None,"Strategic Planning, Financial Analysis, Communication, Adaptability, Medical Knowledge, Team Management, Compliance","Certified Public Accountant, Google Analytics Certified",Looking for an opportunity as a Business Analyst to leverage my expertise in accounting and make a meaningful impact in the industry.
Jessica Wu,40,Non-Binary,PhD,Nursing,PhD in Nursing,Amity University,2015,5,Marketing Manager,None,"Presentation Skills, PowerPoint, Risk Management, Medical Knowledge",None,"Looking for a Marketing Manager role where I can leverage digital marketing, content creation, and data analytics to achieve marketing objectives."
Emily Zhou,43,Male,PhD,Chemistry,PhD in Chemistry,University of Cambridge,2019,0,None,None,"Compliance, Content Writing, Social Media Marketing, Project Management, Adaptability, Budgeting","Licensed Professional Counselor, Certified Sales Professional, Project Management Professional",Targeting a Restaurant Specialist position to utilize my educational background and experience to drive results and achieve career objectives.
Michael Moore,23,Female,Master's,Chemical Engineering,Master's in Chemical Engineering,Indian Institute of Technology Delhi,2021,4,Dentist,None,"Social Media Marketing, Problem Solving, Adaptability, Time Management, Organizational Skills, Healthcare, Budgeting, Critical Thinking",None,Looking for an opportunity as a Dentist to leverage my expertise in chemical engineering and make a meaningful impact in the industry.
Lucas Martin,37,Male,Master's,Biology,Master's in Biology,Pune University,2024,0,None,None,"Patient Care, Healthcare, Problem Solving, Financial Analysis, Negotiation","Google Ads Certified, SHRM Certified Professional, Six Sigma Green Belt",Looking for an opportunity as a Content Manager to leverage my expertise in biology and make a meaningful impact in the industry.
Emily Srinivasan,29,Female,PhD,Business Administration,PhD in Business Administration,Indian Institute of Science,2020,0,None,None,"Social Media Marketing, Data Analysis, Project Management, Risk Management","Google Analytics Certified, Google Ads Certified",Looking for an opportunity as a Market Research Analyst to leverage my expertise in business administration and make a meaningful impact in the industry.
Akash Jackson,42,Non-Binary,Bachelor's,Communications,Bachelor's in Communications,University of Toronto,2020,0,None,None,"Patient Care, PowerPoint, Compliance, SEO, Marketing, Risk Management, Counseling, Critical Thinking",Certified Public Accountant,Looking for an opportunity as a Project Manager to leverage my expertise in communications and make a meaningful impact in the industry.
Rahul Sharma,22,Male,Master's,Sociology,"Master's in Sociology, Bachelor's in Physics",Pune University,2025,0,None,None,"Social Media Marketing, Adaptability, Problem Solving, Organizational Skills, Quality Assurance, Customer Service",None,Targeting a Sales Representative position to utilize my educational background and experience to drive results and achieve career objectives.
Rohan Venkatesh,34,Female,Master's,Business Administration,Master's in Business Administration,Indian Institute of Technology Bombay,2024,1,Counselor,None,"Problem Solving, SEO, Communication, Medical Knowledge, Patient Care, Content Writing, Compliance","Licensed Professional Counselor, Certified Financial Analyst, Google Ads Certified",Seeking a challenging role as a Director of Operations where I can apply my skills and knowledge to contribute to organizational success and professional growth.
Sneha Subramanian,21,Female,Bachelor's,Supply Chain Management,Bachelor's in Supply Chain Management,Armed Forces Medical College,2020,0,None,None,"Patient Care, Healthcare, Quality Assurance, Strategic Planning, Financial Analysis, Critical Thinking",Facebook Blueprint Certified,Seeking a challenging role as a Customer Success Manager where I can apply my skills and knowledge to contribute to organizational success and professional growth.
Amelia Lee,31,Non-Binary,Master's,Medicine,"Master's in Medicine, Bachelor's in Operations Management",London School of Economics,2021,3,Nurse,Salesperson,"Financial Analysis, SEO, Data Analysis, Marketing",Digital Marketing Institute Certified,"Looking for a nursing role where I can contribute to patient recovery, health education, and interdisciplinary healthcare team collaboration."
Arjun Wu,31,Non-Binary,Bachelor's,Psychology,Bachelor's in Psychology,Pune University,2015,0,None,None,"Data Analysis, Time Management, Sales, Customer Service","Six Sigma Green Belt, HubSpot Content Marketing",Targeting a Market Research Analyst position to utilize my educational background and experience to drive results and achieve career objectives.
Aadhya Agarwal,36,Non-Binary,Master's,Physics,Master's in Physics,University of Oxford,2022,0,None,None,"Social Media Marketing, Excel, Financial Analysis, Team Management, Customer Service, Organizational Skills, Adaptability","Certified Financial Analyst, Project Management Professional",Targeting a Operations Manager position to utilize my educational background and experience to drive results and achieve career objectives.
Michael Miller,26,Non-Binary,PhD,Marketing,PhD in Marketing,Columbia University,2020,2,Social Media Manager,None,"SEO, Project Management, PowerPoint, Problem Solving",Google Ads Certified,Targeting a Social Media Manager position to utilize my educational background and experience to drive results and achieve career objectives.
Alexander Wu,38,Male,Master's,Chemistry,Master's in Chemistry,SRM Institute of Science and Technology,2023,1,Brand Manager,None,"Psychology, Problem Solving, Quality Assurance, Data Analysis, Adaptability",Certified Public Accountant,Looking for an opportunity as a Brand Manager to leverage my expertise in chemistry and make a meaningful impact in the industry.
Aditi Singh,42,Female,Bachelor's,Sociology,Bachelor's in Sociology,Carnegie Mellon University,2017,2,Human Resources Manager,None,"Budgeting, Emotional Intelligence, Psychology, Strategic Planning, Financial Analysis, Sales",None,Looking for an opportunity as a Customer Success Manager to leverage my expertise in sociology and make a meaningful impact in the industry.
Andrew Menon,40,Non-Binary,Master's,Chemical Engineering,"Master's in Chemical Engineering, Bachelor's in Sociology",National Institute of Technology Trichy,2022,1,Project Manager,None,"Customer Service, Accounting, Presentation Skills, Compliance, Healthcare, Excel, Budgeting, Sales",Certified Sales Professional,Targeting a Digital Marketing Specialist position to utilize my educational background and experience to drive results and achieve career objectives.
Alexander Chen,26,Male,PhD,Chemistry,PhD in Chemistry,Indian Institute of Science,2021,1,Mental Health Practitioner,None,"Project Management, Strategic Planning, Adaptability, Patient Care, Excel, Marketing, Medical Knowledge, Leadership","Licensed Professional Counselor, Google Ads Certified","Targeting a Mental Health Practitioner position to make a meaningful impact in people's lives through professional counseling, assessment, and treatment planning."
Sneha Mittal,29,Non-Binary,PhD,Biology,PhD in Biology,All India Institute of Medical Sciences,2022,2,Counselor,None,"Communication, Team Management, Financial Analysis, Budgeting, Risk Management, Counseling",None,Seeking a challenging role as a Counselor where I can apply my skills and knowledge to contribute to organizational success and professional growth.
Harper Taylor,26,Female,Bachelor's,Political Science,Bachelor's in Political Science,Columbia University,2024,1,Project Manager,None,"Problem Solving, Financial Analysis, Leadership, Medical Knowledge, Time Management, Sales","Google Ads Certified, Certified Public Accountant",Seeking a challenging role as a Customer Success Manager where I can apply my skills and knowledge to contribute to organizational success and professional growth.
Aadhya Kim,42,Non-Binary,Master's,Supply Chain Management,Master's in Supply Chain Management,Christian Medical College,2024,0,None,None,"Negotiation, Marketing, Strategic Planning, Time Management, Presentation Skills, Problem Solving","Six Sigma Green Belt, Google Ads Certified",Targeting a Digital Marketing Specialist position to utilize my educational background and experience to drive results and achieve career objectives.
Diya Kumar,30,Female,Master's,Education,Master's in Education,Pune University,2019,1,Project Manager,None,"Sales, Time Management, Medical Knowledge, Presentation Skills, Emotional Intelligence, Strategic Planning, Social Media Marketing","Google Analytics Certified, Project Management Professional, Certified Public Accountant",Targeting a Social Media Manager position to utilize my educational background and experience to drive results and achieve career objectives.
Sophia Srinivasan,35,Male,Master's,Medicine,Master's in Medicine,Stanford University,2024,0,None,None,"Content Writing, Marketing, Compliance, Leadership","Digital Marketing Institute Certified, SHRM Certified Professional, Google Analytics Certified",Seeking a challenging role as a Sales Representative where I can apply my skills and knowledge to contribute to organizational success and professional growth.
Arya Jain,22,Male,High School,Medicine,High School in Medicine,Indian Institute of Technology Bombay,2023,2,Business Development Manager,None,"Leadership, Strategic Planning, Healthcare, Budgeting","Registered Nurse License, Certified Public Accountant, Project Management Professional","Targeting a Business Development Manager position to contribute to organizational growth through strategic planning, client acquisition, and partnership development."
Christopher Reddy,43,Female,Bachelor's,English Literature,Bachelor's in English Literature,Amity University,2023,1,Dentist,None,"Excel, Psychology, Quality Assurance, Patient Care, Team Management, Content Writing",None,Targeting a Dentist position to utilize my educational background and experience to drive results and achieve career objectives.
Akash Srinivasan,37,Male,Master's,Dentistry,"Master's in Dentistry, Bachelor's in Nursing",Indian Institute of Technology Bombay,2022,3,Mental Health Practitioner,Restaurant Specialist,"Social Media Marketing, Excel, SEO, Content Writing, PowerPoint, Financial Analysis, Organizational Skills, Risk Management",None,"Looking for a Marketing Manager role where I can leverage digital marketing, content creation, and data analytics to achieve marketing objectives."
Joshua Srinivasan,33,Female,PhD,Biology,"PhD in Biology, Bachelor's in Sociology",All India Institute of Medical Sciences,2020,0,None,None,"Financial Analysis, Healthcare, Time Management, Customer Service",None,"Targeting a Mental Health Practitioner position to make a meaningful impact in people's lives through professional counseling, assessment, and treatment planning."
Akash Liu,28,Female,High School,Civil Engineering,High School in Civil Engineering,Indian Institute of Technology Delhi,2020,1,Project Manager,None,"Sales, Patient Care, Adaptability, Medical Knowledge, Organizational Skills, Social Media Marketing","Project Management Professional, Six Sigma Green Belt, SHRM Certified Professional",Targeting a Project Manager position to utilize my educational background and experience to drive results and achieve career objectives.
Olivia Rodriguez,38,Male,Bachelor's,Human Resources,Bachelor's in Human Resources,Christian Medical College,2023,2,Sales Representative,None,"Patient Care, SEO, Excel, Adaptability, Presentation Skills, Quality Assurance, Communication, Problem Solving",Six Sigma Green Belt,Looking for an opportunity as a Sales Representative to leverage my expertise in human resources and make a meaningful impact in the industry.
Vikram Chen,42,Non-Binary,Master's,Communications,Master's in Communications,Pune University,2015,3,Dentist,None,"Leadership, Psychology, Patient Care, Organizational Skills, PowerPoint, Customer Service","Certified Financial Analyst, Certified Public Accountant",Seeking a challenging role as a Dentist where I can apply my skills and knowledge to contribute to organizational success and professional growth.
Harper Wang,45,Female,Master's,Sociology,Master's in Sociology,Chennai University,2020,0,None,None,"Data Analysis, Healthcare, Communication, Content Writing, Team Management, Time Management, Risk Management, Compliance","Digital Marketing Institute Certified, Certified Public Accountant",Looking for an opportunity as a Business Analyst to leverage my expertise in sociology and make a meaningful impact in the industry.
Rahul White,30,Non-Binary,Bachelor's,Human Resources,Bachelor's in Human Resources,Harvard University,2024,1,Marketing Manager,None,"Organizational Skills, Healthcare, Adaptability, Customer Service, Patient Care, Team Management, Project Management",HubSpot Content Marketing,Looking for an opportunity as a Social Media Manager to leverage my expertise in human resources and make a meaningful impact in the industry.
Liam Smith,25,Non-Binary,PhD,Biology,"PhD in Biology, Bachelor's in English Literature",Bangalore University,2025,0,None,None,"Strategic Planning, Accounting, Leadership, Patient Care, Counseling, Social Media Marketing, Psychology, Medical Knowledge","HubSpot Content Marketing, Digital Marketing Institute Certified",Looking for an opportunity as a Business Analyst to leverage my expertise in biology and make a meaningful impact in the industry.
Abhinav Wilson,34,Non-Binary,Bachelor's,Journalism,Bachelor's in Journalism,All India Institute of Medical Sciences,2018,5,Social Media Manager,None,"Psychology, Compliance, Communication, Leadership, Project Management",None,Looking for an opportunity as a Social Media Manager to leverage my expertise in journalism and make a meaningful impact in the industry.
Emma Brown,25,Female,PhD,Chemical Engineering,"PhD in Chemical Engineering, Bachelor's in Architecture",Birla Institute of Technology,2017,7,Business Development Manager,Marketing Manager,"SEO, Critical Thinking, Accounting, Psychology, Risk Management, Patient Care, Social Media Marketing, Communication",None,"Seeking a Business Development Manager position to identify new market opportunities, build strategic partnerships, and drive revenue growth through relationship building."
Alexander Menon,45,Female,High School,Marketing,High School in Marketing,University of California Berkeley,2025,0,None,None,"Project Management, Customer Service, Quality Assurance, Organizational Skills, Data Analysis, Communication",Certified Financial Analyst,"Seeking a Registered Nurse position to provide high-quality patient care in a healthcare setting, utilizing clinical skills and compassionate bedside manner."
Harper Gupta,44,Male,Master's,Medicine,Master's in Medicine,Delhi University,2025,0,None,None,"Social Media Marketing, Excel, Team Management, Budgeting",None,Looking for an opportunity as a Human Resources Manager to leverage my expertise in medicine and make a meaningful impact in the industry.
Ava Wang,41,Male,PhD,Journalism,PhD in Journalism,Armed Forces Medical College,2020,0,None,None,"Critical Thinking, Organizational Skills, Marketing, Patient Care, Quality Assurance, Strategic Planning, Budgeting, Compliance","Registered Nurse License, SHRM Certified Professional, Six Sigma Green Belt",Looking for an opportunity as a Salesperson to leverage my expertise in journalism and make a meaningful impact in the industry.
Lucas Reddy,45,Male,Bachelor's,Human Resources,Bachelor's in Human Resources,Manipal Institute of Technology,2016,0,None,None,"Quality Assurance, Content Writing, Negotiation, Sales, Patient Care, Compliance, Accounting, Time Management",None,Looking for an opportunity as a Dentist to leverage my expertise in human resources and make a meaningful impact in the industry.
Abhinav Mittal,32,Non-Binary,Master's,Physics,Master's in Physics,University of Washington,2021,3,Project Manager,Nurse,"Strategic Planning, Budgeting, Organizational Skills, PowerPoint, Psychology","HubSpot Content Marketing, Six Sigma Green Belt, Google Analytics Certified",Targeting a Counselor position to utilize my educational background and experience to drive results and achieve career objectives.
Harper Thompson,27,Non-Binary,Master's,Education,Master's in Education,Technical University of Munich,2021,4,Restaurant Specialist,Nurse,"Quality Assurance, Excel, Time Management, Content Writing, Customer Service, SEO",Registered Nurse License,Looking for an opportunity as a Restaurant Specialist to leverage my expertise in education and make a meaningful impact in the industry.
Ethan Davis,43,Male,Bachelor's,Civil Engineering,Bachelor's in Civil Engineering,Indian Institute of Technology Delhi,2024,0,None,None,"Counseling, Customer Service, Data Analysis, Excel, Compliance, Sales",Google Ads Certified,Looking for an opportunity as a Content Manager to leverage my expertise in civil engineering and make a meaningful impact in the industry.
Andrew Wilson,24,Male,Master's,Education,"Master's in Education, Bachelor's in Biology",University of Cambridge,2022,0,None,None,"Sales, Presentation Skills, Customer Service, Budgeting","Certified Public Accountant, SHRM Certified Professional, Certified Sales Professional",Targeting a Salesperson position to utilize my educational background and experience to drive results and achieve career objectives.
Ashley Johnson,26,Non-Binary,High School,Education,High School in Education,Birla Institute of Technology,2015,10,Content Manager,"Director of Operations, Sales Representative, Customer Success Manager","Presentation Skills, Critical Thinking, Medical Knowledge, Budgeting, Social Media Marketing, Counseling",None,Seeking a challenging role as a Content Manager where I can apply my skills and knowledge to contribute to organizational success and professional growth.
Aadhya Smith,34,Non-Binary,PhD,Marketing,PhD in Marketing,Mumbai University,2015,0,None,None,"Emotional Intelligence, PowerPoint, Data Analysis, Counseling","Certified Financial Analyst, Certified Sales Professional",Looking for an opportunity as a Director of Operations to leverage my expertise in marketing and make a meaningful impact in the industry.
Ananya Wu,35,Non-Binary,Bachelor's,Accounting,Bachelor's in Accounting,SRM Institute of Science and Technology,2025,0,None,None,"Project Management, Counseling, Compliance, Psychology, Organizational Skills, Emotional Intelligence, Data Analysis, Critical Thinking",None,Seeking a challenging role as a Human Resources Manager where I can apply my skills and knowledge to contribute to organizational success and professional growth.
Aditi Sharma,33,Female,Diploma,Communications,Diploma in Communications,University of Oxford,2020,0,None,None,"Communication, PowerPoint, Counseling, Accounting, Organizational Skills, Project Management",None,Seeking a challenging role as a Account Manager where I can apply my skills and knowledge to contribute to organizational success and professional growth.
Noah Jackson,22,Non-Binary,Master's,Operations Management,Master's in Operations Management,Bangalore University,2020,1,Digital Marketing Specialist,None,"Strategic Planning, Adaptability, Sales, Presentation Skills","SHRM Certified Professional, Facebook Blueprint Certified",Targeting a Salesperson position to utilize my educational background and experience to drive results and achieve career objectives.
Emily Mittal,22,Female,Bachelor's,Business Administration,Bachelor's in Business Administration,Massachusetts Institute of Technology,2023,1,Nurse,None,"Compliance, Communication, Critical Thinking, Quality Assurance, Excel, Organizational Skills, PowerPoint",None,"Seeking a Registered Nurse position to provide high-quality patient care in a healthcare setting, utilizing clinical skills and compassionate bedside manner."
Andrew Wang,28,Female,Master's,Education,"Master's in Education, Bachelor's in Chemical Engineering",University of Pennsylvania,2021,1,Digital Marketing Specialist,None,"PowerPoint, Excel, Organizational Skills, Adaptability, Psychology",Project Management Professional,Seeking a challenging role as a Digital Marketing Specialist where I can apply my skills and knowledge to contribute to organizational success and professional growth.
Noah Smith,41,Female,PhD,Marketing,"PhD in Marketing, Bachelor's in English Literature",University of Toronto,2017,2,Operations Manager,None,"Healthcare, Critical Thinking, Problem Solving, Social Media Marketing, Patient Care",HubSpot Content Marketing,Targeting a Operations Manager position to utilize my educational background and experience to drive results and achieve career objectives.
Ashley Zhou,25,Male,Master's,Pharmacy,Master's in Pharmacy,Indian Institute of Technology Delhi,2025,0,None,None,"Strategic Planning, Communication, Team Management, Medical Knowledge",None,Targeting a Director of Operations position to utilize my educational background and experience to drive results and achieve career objectives.
Rohan Martin,37,Female,Bachelor's,Accounting,Bachelor's in Accounting,Indian Institute of Technology Delhi,2019,2,Human Resources Manager,None,"Healthcare, Patient Care, Accounting, Presentation Skills",SHRM Certified Professional,Looking for an opportunity as a Market Research Analyst to leverage my expertise in accounting and make a meaningful impact in the industry.
Samantha Krishnan,38,Non-Binary,Master's,Journalism,"Master's in Journalism, Bachelor's in Medicine",Armed Forces Medical College,2025,0,None,None,"SEO, Financial Analysis, Adaptability, Patient Care",None,"Seeking a Business Development Manager position to identify new market opportunities, build strategic partnerships, and drive revenue growth through relationship building."
Aadhya Wang,25,Female,Bachelor's,Architecture,Bachelor's in Architecture,London School of Economics,2016,0,None,None,"Problem Solving, Budgeting, Leadership, Social Media Marketing",None,Looking for a Business Development Manager role where I can utilize my sales expertise and market knowledge to expand business reach and profitability.
Emma Jones,43,Non-Binary,High School,Nursing,High School in Nursing,Chennai University,2024,0,None,None,"Sales, SEO, Strategic Planning, Counseling, Marketing","Google Ads Certified, Project Management Professional, Certified Sales Professional","Seeking a Marketing Manager position to develop and execute comprehensive marketing strategies that drive brand awareness, customer engagement, and revenue growth."
Andrew Jain,37,Female,Bachelor's,Chemistry,Bachelor's in Chemistry,Pune University,2023,2,Director of Operations,None,"Customer Service, Critical Thinking, Organizational Skills, Psychology, Presentation Skills, Counseling, Negotiation, Quality Assurance",None,Looking for an opportunity as a Director of Operations to leverage my expertise in chemistry and make a meaningful impact in the industry.
Jackson Reddy,38,Non-Binary,Master's,Nursing,Master's in Nursing,University of California Berkeley,2023,0,None,None,"Healthcare, Content Writing, Problem Solving, Budgeting, Organizational Skills, Negotiation, Customer Service, Patient Care","Licensed Professional Counselor, HubSpot Content Marketing",Targeting a Dentist position to utilize my educational background and experience to drive results and achieve career objectives.
