Name,Age,Gender,Education_Level,Field_of_Study,Degrees,Institute_Name,Graduation_Year,Experience_Years,Current_Job_Title,Previous_Job_Titles,Skills,Certifications,Target_Job_Description
Ashley Liu,44,Female,Diploma,Cybersecurity,Diploma in Cybersecurity,University of Toronto,2019,0,None,None,"TensorFlow, Linux, Cybersecurity, Deep Learning, CI/CD","Certified Kubernetes Administrator, Project Management Professional",Seeking a challenging role as a Mobile Applications Developer where I can apply my skills and knowledge to contribute to organizational success and professional growth.
Ankit Kim,34,Female,Bachelor's,Machine Learning,Bachelor's in Machine Learning,Massachusetts Institute of Technology,2016,8,Quantum Computing Specialist,MLOps Specialist,"React, Cloud Computing, CI/CD, Java, Blockchain, JavaScript, Kafka, Linux","Cisco Certified Network Associate, Scrum Master Certified, Certified Information Systems Security Professional","Seeking a Data Scientist role to apply statistical analysis, machine learning, and data visualization techniques to extract meaningful insights from complex datasets and drive data-driven decision making."
Meera White,40,Non-Binary,Certificate,Information Technology,Certificate in Information Technology,Christian Medical College,2015,4,Backend Developer,AI Engineer,"Data Analysis, Cybersecurity, Solidity, Docker, Agile, Node.js, TensorFlow","TensorFlow Developer Certificate, Google Data Analytics Professional",Seeking a challenging role as a Backend Developer where I can apply my skills and knowledge to contribute to organizational success and professional growth.
Sophia Wilson,34,Male,Bachelor's,Data Science,Bachelor's in Data Science,Technical University of Munich,2017,0,None,None,"Terraform, Cybersecurity, PyTorch, Scrum, Docker, Jenkins",Certified Kubernetes Administrator,Targeting a Software Developer position to utilize my educational background and experience to drive results and achieve career objectives.
Diya Singh,45,Male,Master's,Information Technology,Master's in Information Technology,Indian Institute of Technology Bombay,2017,7,Prompt Engineer,"AI Engineer, Mobile Applications Developer, Software Engineer","Deep Learning, Machine Learning, PyTorch, Git, Kubernetes, Blockchain","Certified Kubernetes Administrator, Oracle Certified Professional",Looking for an opportunity as a Prompt Engineer to leverage my expertise in information technology and make a meaningful impact in the industry.
Aditi Thompson,35,Female,Bachelor's,Artificial Intelligence,Bachelor's in Artificial Intelligence,National Institute of Technology Trichy,2018,0,None,None,"SQL, TensorFlow, Cloud Computing, Kafka",None,Looking for an opportunity as a Software Developer to leverage my expertise in artificial intelligence and make a meaningful impact in the industry.
Joshua Subramanian,32,Non-Binary,Certificate,Artificial Intelligence,Certificate in Artificial Intelligence,University of Pennsylvania,2015,0,None,None,"SQL, Cloud Computing, CI/CD, Penetration Testing, Computer Vision",None,"Looking for a Software Engineer role where I can contribute to full-stack development, write clean and maintainable code, and collaborate with cross-functional teams."
Amelia Agarwal,32,Female,PhD,Information Technology,PhD in Information Technology,Birla Institute of Technology,2024,0,None,None,"Deep Learning, SQL, Microservices, Penetration Testing, Java, Data Analysis","AWS Certified Solutions Architect, Microsoft Azure Fundamentals",Targeting a Site Reliability Engineer position to utilize my educational background and experience to drive results and achieve career objectives.
Arya Bansal,43,Female,Master's,Computer Science,Master's in Computer Science,Birla Institute of Technology,2020,0,None,None,"Statistics, CI/CD, GraphQL, Kubernetes, TensorFlow",Google Data Analytics Professional,Seeking a challenging role as a Cloud Architect where I can apply my skills and knowledge to contribute to organizational success and professional growth.
Aarav Rao,27,Female,Bachelor's,Cybersecurity,Bachelor's in Cybersecurity,National Institute of Technology Trichy,2017,0,None,None,"Linux, Java, Kafka, Agile, Jenkins, Penetration Testing, JavaScript, Docker","AWS Certified Solutions Architect, Google Data Analytics Professional, Certified Ethical Hacker",Looking for an opportunity as a Blockchain Engineer to leverage my expertise in cybersecurity and make a meaningful impact in the industry.
Sophia Gupta,34,Male,Bachelor's,Machine Learning,Bachelor's in Machine Learning,Chennai University,2024,0,None,None,"Terraform, Solidity, Azure, Python, Git, Penetration Testing, DevOps","Microsoft Azure Fundamentals, Certified Information Systems Security Professional",Looking for an opportunity as a Mobile Applications Developer to leverage my expertise in machine learning and make a meaningful impact in the industry.
Rahul Yang,39,Male,Bachelor's,Information Systems,Bachelor's in Information Systems,Amity University,2018,4,Machine Learning Engineer,Backend Developer,"Deep Learning, SQL, MongoDB, REST APIs, Statistics",None,Targeting a Machine Learning Engineer position to utilize my educational background and experience to drive results and achieve career objectives.
Vikram Iyer,39,Female,Master's,Software Engineering,"Master's in Software Engineering, Bachelor's in Computer Science",Amity University,2017,0,None,None,"CI/CD, Docker, JavaScript, Microservices, React, PyTorch, TensorFlow",None,Targeting a Prompt Engineer position to utilize my educational background and experience to drive results and achieve career objectives.
Priya Reddy,32,Male,Master's,Electrical Engineering,"Master's in Electrical Engineering, Bachelor's in Machine Learning",University of Pennsylvania,2025,0,None,None,"Machine Learning, Cybersecurity, Computer Vision, Terraform, Solidity, AWS, Data Analysis","Certified Information Systems Security Professional, Microsoft Azure Fundamentals",Looking for an opportunity as a Full-Stack Developer to leverage my expertise in electrical engineering and make a meaningful impact in the industry.
Samantha Iyer,29,Male,Master's,Artificial Intelligence,Master's in Artificial Intelligence,Georgia Institute of Technology,2020,3,Cybersecurity Engineer,None,"Terraform, Azure, MongoDB, Deep Learning","Google Cloud Professional, Oracle Certified Professional, Google Data Analytics Professional",Targeting a Cybersecurity Engineer position to utilize my educational background and experience to drive results and achieve career objectives.
Liam Moore,37,Male,Bachelor's,Electronics Engineering,Bachelor's in Electronics Engineering,Stanford University,2023,0,None,None,"PyTorch, Scrum, DevOps, Spark",Scrum Master Certified,Targeting a Product Manager position to lead cross-functional teams in building products that meet customer needs and achieve business objectives.
Vikram Smith,32,Male,Bachelor's,Software Engineering,Bachelor's in Software Engineering,Armed Forces Medical College,2022,1,UI/UX Designer,None,"Deep Learning, Docker, Terraform, Blockchain, PyTorch, Data Analysis, React, REST APIs","Certified Ethical Hacker, Google Data Analytics Professional",Seeking a challenging role as a Cybersecurity Engineer where I can apply my skills and knowledge to contribute to organizational success and professional growth.
Aisha Miller,43,Non-Binary,Master's,Data Science,Master's in Data Science,Vellore Institute of Technology,2018,1,Cloud Architect,None,"Node.js, React, GraphQL, Azure, Docker, Penetration Testing, Kubernetes, Natural Language Processing","Oracle Certified Professional, Microsoft Azure Fundamentals, Project Management Professional",Looking for an opportunity as a Cloud Architect to leverage my expertise in data science and make a meaningful impact in the industry.
Arjun Moore,24,Non-Binary,Master's,Electronics Engineering,Master's in Electronics Engineering,University of California Berkeley,2025,0,None,None,"Solidity, Docker, Data Analysis, Linux, Python",None,Seeking a challenging role as a Machine Learning Engineer where I can apply my skills and knowledge to contribute to organizational success and professional growth.
Jessica Thompson,30,Male,Master's,Electrical Engineering,Master's in Electrical Engineering,National Institute of Technology Trichy,2022,1,Mobile Applications Developer,None,"Node.js, Agile, Data Analysis, JavaScript, Microservices","Google Cloud Professional, Project Management Professional",Seeking a challenging role as a Mobile Applications Developer where I can apply my skills and knowledge to contribute to organizational success and professional growth.
Amanda Subramanian,40,Female,Bachelor's,Electronics Engineering,Bachelor's in Electronics Engineering,University of Toronto,2020,0,None,None,"GraphQL, React, MongoDB, Data Analysis, Ansible, Computer Vision, Cloud Computing","Certified Ethical Hacker, Project Management Professional",Seeking a challenging role as a AI Ethics Officer where I can apply my skills and knowledge to contribute to organizational success and professional growth.
Matthew Rao,28,Non-Binary,Master's,Electrical Engineering,Master's in Electrical Engineering,University of California Berkeley,2024,0,None,None,"MongoDB, Network Security, Ansible, Microservices, DevOps, Jenkins",None,Seeking a challenging role as a Site Reliability Engineer where I can apply my skills and knowledge to contribute to organizational success and professional growth.
Charlotte Srinivasan,42,Non-Binary,PhD,Artificial Intelligence,PhD in Artificial Intelligence,Christian Medical College,2025,0,None,None,"Scrum, Solidity, Cybersecurity, Jenkins",None,Seeking a challenging role as a Full-Stack Developer where I can apply my skills and knowledge to contribute to organizational success and professional growth.
Meera Johnson,21,Non-Binary,PhD,Information Technology,PhD in Information Technology,University of Toronto,2017,8,UI/UX Designer,"Big Data Engineer, DevOps Engineer, AI Ethics Officer","Java, Cybersecurity, Computer Vision, Scrum, Ansible, Terraform, Natural Language Processing","TensorFlow Developer Certificate, AWS Certified Solutions Architect","Seeking a UI/UX Designer role to create intuitive and engaging user experiences through user research, wireframing, prototyping, and visual design."
Emily Taylor,40,Non-Binary,Master's,Data Science,Master's in Data Science,London School of Economics,2020,1,Prompt Engineer,None,"MongoDB, SQL, REST APIs, Linux, Network Security, TensorFlow","Certified Kubernetes Administrator, Cisco Certified Network Associate, TensorFlow Developer Certificate",Seeking a challenging role as a Prompt Engineer where I can apply my skills and knowledge to contribute to organizational success and professional growth.
Olivia Srinivasan,30,Non-Binary,Master's,Information Systems,Master's in Information Systems,Bangalore University,2021,0,None,None,"Terraform, TensorFlow, REST APIs, Node.js, PyTorch, SQL, DevOps, Jenkins","Microsoft Azure Fundamentals, CompTIA Security+",Looking for a UI/UX Designer position where I can combine creativity with analytical thinking to design user-centered interfaces that solve real problems.
Ananya Yang,30,Non-Binary,Master's,Information Technology,"Master's in Information Technology, Bachelor's in Robotics",SRM Institute of Science and Technology,2018,7,Prompt Engineer,Machine Learning Engineer,"Solidity, JavaScript, Natural Language Processing, Ansible, Docker","AWS Certified Solutions Architect, TensorFlow Developer Certificate",Seeking a challenging role as a Prompt Engineer where I can apply my skills and knowledge to contribute to organizational success and professional growth.
Isabella Garcia,21,Non-Binary,Master's,Machine Learning,Master's in Machine Learning,University of Toronto,2021,1,Site Reliability Engineer,None,"Ansible, Jenkins, PyTorch, GraphQL, TensorFlow, DevOps, REST APIs, Microservices","CompTIA Security+, Certified Information Systems Security Professional",Looking for an opportunity as a Site Reliability Engineer to leverage my expertise in machine learning and make a meaningful impact in the industry.
Aisha Wang,25,Female,PhD,Robotics,PhD in Robotics,SRM Institute of Science and Technology,2022,0,None,None,"Kafka, Azure, MongoDB, Cloud Computing, Penetration Testing, Linux, Jenkins, Deep Learning","CompTIA Security+, Oracle Certified Professional","Looking for a Product Manager role where I can leverage market research, user feedback, and data analysis to guide product development decisions."
Karan Thompson,36,Non-Binary,Bachelor's,Software Engineering,Bachelor's in Software Engineering,University of Oxford,2024,0,None,None,"Solidity, Ansible, React, Scrum, Penetration Testing, Docker, Node.js, Kafka",None,"Targeting an AI Engineer position to contribute to the development of intelligent systems using Python, TensorFlow, and PyTorch. Eager to work on large-scale AI projects in a collaborative environment."
Diya Rao,34,Non-Binary,Master's,Software Engineering,Master's in Software Engineering,Indian Institute of Technology Delhi,2024,0,None,None,"Solidity, Git, Terraform, Agile, Deep Learning","Microsoft Azure Fundamentals, Google Data Analytics Professional, Project Management Professional",Looking for an opportunity as a Full-Stack Developer to leverage my expertise in software engineering and make a meaningful impact in the industry.
Aryan Jain,45,Male,Master's,Information Systems,"Master's in Information Systems, Bachelor's in Artificial Intelligence",Pune University,2021,3,Site Reliability Engineer,DevOps Engineer,"PyTorch, Natural Language Processing, Spark, TensorFlow, Java","CompTIA Security+, Google Cloud Professional, Certified Information Systems Security Professional",Seeking a challenging role as a Site Reliability Engineer where I can apply my skills and knowledge to contribute to organizational success and professional growth.
Mason Taylor,26,Non-Binary,Bachelor's,Computer Engineering,Bachelor's in Computer Engineering,Harvard University,2020,0,None,None,"TensorFlow, Computer Vision, REST APIs, PyTorch",Certified Information Systems Security Professional,Targeting a AI Ethics Officer position to utilize my educational background and experience to drive results and achieve career objectives.
Ava Verma,40,Male,Certificate,Computer Science,Certificate in Computer Science,Indian Institute of Technology Bombay,2024,0,None,None,"MongoDB, Kubernetes, Python, DevOps, Jenkins, Terraform","Certified Ethical Hacker, Cisco Certified Network Associate",Seeking a challenging role as a Backend Developer where I can apply my skills and knowledge to contribute to organizational success and professional growth.
Olivia Lee,40,Female,Bachelor's,Data Science,Bachelor's in Data Science,Birla Institute of Technology,2023,0,None,None,"Docker, Spark, CI/CD, Jenkins",TensorFlow Developer Certificate,Looking for an opportunity as a Big Data Engineer to leverage my expertise in data science and make a meaningful impact in the industry.
Aarav Venkatesh,22,Non-Binary,PhD,Information Technology,PhD in Information Technology,Mumbai University,2022,3,Cloud Engineer,None,"MongoDB, Scrum, TensorFlow, DevOps, Kubernetes, Spark","Certified Kubernetes Administrator, Scrum Master Certified, Microsoft Azure Fundamentals",Looking for a UI/UX Designer position where I can combine creativity with analytical thinking to design user-centered interfaces that solve real problems.
Jackson Thomas,25,Male,Diploma,Machine Learning,Diploma in Machine Learning,All India Institute of Medical Sciences,2023,1,Software Engineer,None,"JavaScript, Scrum, React, Penetration Testing, MongoDB, DevOps, SQL","Google Data Analytics Professional, Scrum Master Certified","Looking for a Software Engineer role where I can contribute to full-stack development, write clean and maintainable code, and collaborate with cross-functional teams."
Samantha Williams,30,Non-Binary,Bachelor's,Artificial Intelligence,Bachelor's in Artificial Intelligence,Yale University,2019,5,Full-Stack Developer,None,"Network Security, Java, MongoDB, Linux","Scrum Master Certified, Certified Ethical Hacker, Cisco Certified Network Associate",Seeking a challenging role as a Full-Stack Developer where I can apply my skills and knowledge to contribute to organizational success and professional growth.
Akash Martinez,39,Non-Binary,PhD,Information Systems,PhD in Information Systems,Stanford University,2025,0,None,None,"React, Terraform, Java, Spark, Git, Microservices",Certified Information Systems Security Professional,"Targeting a DevOps Engineer role to work with containerization technologies, configuration management tools, and cloud platforms to optimize software delivery."
Sneha Iyer,26,Non-Binary,Bachelor's,Robotics,Bachelor's in Robotics,Manipal Institute of Technology,2022,0,None,None,"MongoDB, Cybersecurity, TensorFlow, Deep Learning, Linux",None,"Seeking a Data Scientist role to apply statistical analysis, machine learning, and data visualization techniques to extract meaningful insights from complex datasets and drive data-driven decision making."
Alexander Brown,43,Male,PhD,Computer Science,PhD in Computer Science,University of Toronto,2021,2,Product Manager,None,"TensorFlow, Microservices, Deep Learning, CI/CD, REST APIs, JavaScript",Microsoft Azure Fundamentals,Targeting a Product Manager position to lead cross-functional teams in building products that meet customer needs and achieve business objectives.
Joshua Davis,34,Non-Binary,High School,Artificial Intelligence,High School in Artificial Intelligence,Massachusetts Institute of Technology,2025,0,None,None,"PyTorch, Network Security, Computer Vision, Python, REST APIs, JavaScript","Microsoft Azure Fundamentals, Project Management Professional, Certified Kubernetes Administrator",Seeking a challenging role as a Full-Stack Developer where I can apply my skills and knowledge to contribute to organizational success and professional growth.
Rahul Patel,26,Non-Binary,Bachelor's,Robotics,Bachelor's in Robotics,Yale University,2018,0,None,None,"Statistics, Terraform, Spark, Jenkins, Computer Vision, MongoDB, AWS","Certified Kubernetes Administrator, Google Cloud Professional, Google Data Analytics Professional",Seeking a challenging role as a Blockchain Engineer where I can apply my skills and knowledge to contribute to organizational success and professional growth.
Priya Reddy,24,Male,Bachelor's,Artificial Intelligence,Bachelor's in Artificial Intelligence,Indian Institute of Science,2025,0,None,None,"Node.js, Natural Language Processing, Blockchain, CI/CD","CompTIA Security+, Microsoft Azure Fundamentals, TensorFlow Developer Certificate","Seeking a DevOps Engineer role to bridge development and operations teams by implementing CI/CD pipelines, infrastructure automation, and monitoring solutions."
Andrew Brown,44,Female,High School,Computer Science,High School in Computer Science,Massachusetts Institute of Technology,2018,3,Machine Learning Engineer,AI Engineer,"Computer Vision, TensorFlow, Scrum, Cybersecurity, PyTorch, React","Certified Ethical Hacker, Microsoft Azure Fundamentals, Cisco Certified Network Associate",Looking for an opportunity as a Machine Learning Engineer to leverage my expertise in computer science and make a meaningful impact in the industry.
Aisha Garcia,40,Non-Binary,Bachelor's,Software Engineering,Bachelor's in Software Engineering,University of Washington,2016,0,None,None,"Linux, React, AWS, Node.js, GraphQL, DevOps, Java, Kubernetes","Certified Information Systems Security Professional, AWS Certified Solutions Architect",Looking for an opportunity as a Machine Learning Engineer to leverage my expertise in software engineering and make a meaningful impact in the industry.
Aadhya Krishnan,22,Female,Master's,Information Technology,"Master's in Information Technology, Bachelor's in Electrical Engineering",Pune University,2022,1,Product Manager,None,"Jenkins, Terraform, Node.js, Java","Scrum Master Certified, Project Management Professional, Certified Ethical Hacker",Targeting a Product Manager position to lead cross-functional teams in building products that meet customer needs and achieve business objectives.
Ava Taylor,41,Female,Master's,Software Engineering,Master's in Software Engineering,Technical University of Munich,2017,0,None,None,"CI/CD, Deep Learning, Docker, Statistics, TensorFlow, Microservices, Computer Vision, Kubernetes","CompTIA Security+, AWS Certified Solutions Architect",Looking for an opportunity as a Mobile Applications Developer to leverage my expertise in software engineering and make a meaningful impact in the industry.
Matthew Menon,28,Female,Bachelor's,Electronics Engineering,Bachelor's in Electronics Engineering,All India Institute of Medical Sciences,2017,3,Big Data Engineer,None,"REST APIs, GraphQL, Cybersecurity, Solidity, Microservices","Certified Information Systems Security Professional, Oracle Certified Professional, CompTIA Security+",Targeting a Big Data Engineer position to utilize my educational background and experience to drive results and achieve career objectives.
Olivia Zhang,42,Non-Binary,Bachelor's,Machine Learning,Bachelor's in Machine Learning,Stanford University,2018,2,Quantum Computing Specialist,None,"CI/CD, Git, Machine Learning, REST APIs, Docker, Penetration Testing, MongoDB","Cisco Certified Network Associate, Scrum Master Certified, Certified Ethical Hacker",Targeting a Quantum Computing Specialist position to utilize my educational background and experience to drive results and achieve career objectives.
Harper Johnson,35,Male,Master's,Artificial Intelligence,Master's in Artificial Intelligence,Amity University,2017,7,Software Developer,None,"Data Analysis, Jenkins, Docker, REST APIs, PyTorch",Certified Ethical Hacker,Targeting a Software Developer position to utilize my educational background and experience to drive results and achieve career objectives.
Ananya Patel,23,Male,High School,Computer Science,High School in Computer Science,Massachusetts Institute of Technology,2020,2,Prompt Engineer,None,"Linux, Scrum, PyTorch, Docker",Cisco Certified Network Associate,Looking for an opportunity as a Prompt Engineer to leverage my expertise in computer science and make a meaningful impact in the industry.
Priya Anderson,43,Male,Bachelor's,Information Technology,Bachelor's in Information Technology,Columbia University,2019,1,Backend Developer,None,"Docker, Kubernetes, GraphQL, AWS, Terraform","Microsoft Azure Fundamentals, Google Data Analytics Professional, CompTIA Security+",Seeking a challenging role as a Quantum Computing Specialist where I can apply my skills and knowledge to contribute to organizational success and professional growth.
Ethan Agarwal,45,Male,Bachelor's,Artificial Intelligence,Bachelor's in Artificial Intelligence,Yale University,2025,0,None,None,"Penetration Testing, Kubernetes, Java, CI/CD, Solidity, TensorFlow, Terraform",None,Looking for an opportunity as a AI Ethics Officer to leverage my expertise in artificial intelligence and make a meaningful impact in the industry.
Akash Thomas,23,Male,Bachelor's,Computer Engineering,Bachelor's in Computer Engineering,Armed Forces Medical College,2017,4,Backend Developer,MLOps Specialist,"Docker, AWS, PyTorch, Linux, Statistics, SQL, Scrum","AWS Certified Solutions Architect, Scrum Master Certified, CompTIA Security+",Seeking a challenging role as a Backend Developer where I can apply my skills and knowledge to contribute to organizational success and professional growth.
Rahul Wilson,26,Male,Master's,Robotics,Master's in Robotics,Indian Institute of Science,2017,0,None,None,"Solidity, Blockchain, Agile, JavaScript, Data Analysis, Cybersecurity",None,"Targeting a UI/UX Designer role to contribute to the entire design process from concept to implementation, ensuring optimal user satisfaction and usability."
Meera Verma,30,Female,Bachelor's,Machine Learning,Bachelor's in Machine Learning,Bangalore University,2019,3,Full-Stack Developer,None,"JavaScript, Data Analysis, Microservices, Agile, CI/CD, Cloud Computing, Blockchain","CompTIA Security+, Certified Information Systems Security Professional, Microsoft Azure Fundamentals",Looking for an opportunity as a Full-Stack Developer to leverage my expertise in machine learning and make a meaningful impact in the industry.
Jessica Gupta,42,Female,PhD,Information Technology,"PhD in Information Technology, Bachelor's in Data Science",Harvard University,2016,0,None,None,"MongoDB, Natural Language Processing, Node.js, TensorFlow, CI/CD",None,"Seeking a challenging role as an AI Engineer to develop and implement cutting-edge artificial intelligence solutions. Looking to work on machine learning models, neural networks, and AI-driven applications that solve real-world business problems."
Joshua Anderson,40,Male,Bachelor's,Electronics Engineering,Bachelor's in Electronics Engineering,Harvard University,2015,10,Mobile Applications Developer,None,"MongoDB, AWS, React, Azure, PyTorch, SQL",Google Cloud Professional,Targeting a Mobile Applications Developer position to utilize my educational background and experience to drive results and achieve career objectives.
Akash Hernandez,31,Non-Binary,Master's,Machine Learning,"Master's in Machine Learning, Bachelor's in Data Science",University of Toronto,2017,3,Software Engineer,None,"Spark, TensorFlow, Penetration Testing, Statistics, React, Solidity, Kafka",None,"Seeking a Software Engineer position to develop high-quality, scalable software solutions using modern programming languages and development methodologies."
Liam Wilson,45,Male,Bachelor's,Electronics Engineering,Bachelor's in Electronics Engineering,Amity University,2023,0,None,None,"Spark, GraphQL, Cloud Computing, Statistics, Machine Learning, Blockchain","Certified Information Systems Security Professional, CompTIA Security+",Targeting a Software Developer position to utilize my educational background and experience to drive results and achieve career objectives.
